{"acknowledged_unknowns":["unknown:47cc10e1dbf5eeb6","unknown:57128ed88799f3c2","unknown:bc2510bfe711a423"],"artifact":"change-contract","objective":"restore","origin":{"constraint":"JAVASCRIPT-ENTRY","fingerprint":"52c6e76c695fcbcd2bfbf4f21d9bf525c086d24b4f501f3c5cad64762da13de0"},"owner":"architecture","postconditions":["origin-fact-transition"],"preserved_constraints":[],"proposal_sha256":"434cb6315cba20f99c0bd11c09ede1269a60a7ee507af84c369c0085b6989cd6","provenance":"asserted","rationale":"reviewed","schema_version":2,"selected_candidates":[],"sha256":"27e650fb0b57f85276d08968f482841675bd9a5492d139fc9788f641dedd83ab","tool":{"implementation_sha256":"6c0da5fc0f7ea1ff30013fdda52a2816d0a23d6be04cd9e6f9f9a6e862ed5d9a","name":"archbird","version":"0.0.1"}}
